12580,2/21/2011 0:00:00,60,Departamento,Buenos Aires,La Plata,La Plata,Sobre Calle,,12436 // 15 e/ 42 y 43,,,,1,1,1,0,1,1,1,,,56,1,0,2,1,1,5,0,1,1,0,1,0,0,1,1,"Emprendimiento de edificio compuesto por un bloque unico, desarrollado en 9 niveles. Caracteristicas: 1º mamposteria en ladrillo ceramico hueco, con estructura independiente de hormigon armado. 2º Carpinteria en aluminio linea Modema con vidrios reforzados de 4mm de espesor y cortinas de oscurecimiento en dormitorios tipo Black-out. 3º Revoques interiores a la cal fratasados al fieltro, terminados con enduido plastico. 4º Pisos de madera tipo flotantes canadiense o similar en dormitorios unicamente. 5º Ceramicos de 1º calidad en estar comedor/living, cocina y baños. En acceso al hall de entrada, ceramicos tipo porcelanato. 6º Calefaccion por sistema de tiro balanceado (marca Volcan o similar) en dormitorios, y pico taponado en living-comedor. 7º En sector cocina, provision y colocacion de artefacto (marca Escorial Master o similar), con mesada de granito y pileta de acero inoxidable de doble bacha. 8º Muebles armados a medida bajo y sobre mesada en aglomerado enchapado en melamina con cantoneras de aluminio. 9º Conexion a linea de suministro de agua y desague sumidero para futuro lavarropas en sector cocina. 10º Placards con frentes de 2.40 m de altura enchapados en cedro con guias y cantoneras de aluminio e interiores con separacion estandar y cajoneras. 11º Puertas interiores tipo placa de abrir enchapadas en cedro con marcos de chapa plegada nº 18 12º Puertas de acceso tipo placas reforzadas con marcos de madera 13º Cielorrasos armados enlucidos al yeso en baños, pasos y cocina. En estar-comedor bajo losa. 14º Cañerias de distribucion de agua potable en termo-fusion (marca Acqua System o similar), en gas natural con cañerias del tipo Epoxi reglamentaria hasta la red de suministros, y el sistema cloacal de caños de polipropileno (marca Awaduct o similar) aprobado por normas vigentes. 15º Artefactos de baño, con inodoro y bidet (marca Ferrum) color blanco, bañaderas con hierro enlozada y vanitory (bacha y mueble) y griferia tipo FV linea allegro o similar. En cocina, griferia marca FV o similar tipo mono-comando. 16ºInstalacion electrica completa con llaves tipo tecla (marca Jeluz o similar) artefactos de iluminacion, excepto en espacios comunes. 17º Terminacion exterior en revestimiento texturado aplicados sobre revoque a la cal. 18º Ascensor con piso de granito, revestido con acero inoxidable y espejos, de 9 paradas, puertas automaticas, botonera digital. 19º Red contra incendios y bomberos, (escaleras presurizadas con puertas ignifugas, manguera serpentina con difusores, matafuegos, luces de emergencia, sensores de humo y señalizacion de salidas de emergencia en todos los palieres) segun normativa vigente. SE ESTIMA TIEMPO DE OBRA PARA LA FINALIZACION DEL PROYECTO EN 15 MESES CORRIDOS A CONTAR DESDE ENERO DE 2012 ",,,0,US,64000,,
12583,2/22/2011 0:00:00,137,Cocheras,Buenos Aires,La Plata,La Plata,Sobre Calle,PLAZA PASO, 12439// 12 E/ 43 Y 44,576,,,0,0,0,0,0,0,0,,,,0,0,0,0,0,0,0,0,0,0,0,0,0,0,0,COCHERA CUBIERTA EN EDIFICIO CON PORTON AUTOMATIZADO,,,0,,,PE,300
12584,2/22/2011 0:00:00,160,Casa,Buenos Aires,La Plata,Ringuelet,Sobre Calle,,12440 // 510/10,,,,0,1,1,0,1,0,0,,140,140,3,0,6,10,3,9,0,0,0,1,0,0,0,1,0,"Casa desarrollada 100% en planta baja, muy buen estado, parque, gran quincho.- ",,,0,US,170000,,
12585,2/22/2011 0:00:00,160,Departamento,Buenos Aires,La Plata,La Plata,Sobre Calle,,12441 // 64/9,,,,0,1,1,0,1,0,0,10,55,65,1,0,2,20,1,0,0,0,0,0,0,1,0,1,0,"Dpto ideal inversor, alquilado, planta baja, patio, buen estado  ",,,0,US,60000,,
12586,5/27/2011 0:00:00,132,Casa,Buenos Aires,La Plata,La Plata,Sobre Calle,,12442 // 40-2y3,,,,1,1,1,0,1,0,1,40,160,,2,2,8,35,2,0,0,1,0,0,0,1,0,1,1,"Ph,frente,gge,living-recibidor,cocina,comedor,2baños,2dormitorios,lavadero,patio y terraza con parrilla.(Acepta permuta)Alquilada hasta 31-12-2011",,,0,US,140000,,
12587,2/24/2011 0:00:00,159,Fracción,Buenos Aires,La Plata,La Plata,Sobre Calle,,12443 // 157 entre 63 y 64,,,fraccion ideal para loteo,0,0,0,0,0,0,0,,,7,0,0,0,0,0,0,0,0,0,0,0,0,0,0,0,"fraccion ideal para loteo ,todos los servicios y acceso con calles asfaltadas ,buen entorno",,,0,PE,0,,
12588,2/24/2011 0:00:00,159,Fracción,Buenos Aires,La Plata,Arana,Sobre Calle,,12444 // 643 entre 2 y 3,,,fraccion de 70 de frente x 155 de fondo con casa ,1,1,0,1,0,0,0,,140,10,0,0,0,0,0,0,0,0,0,0,0,0,0,0,0,"hermosa fraccion con vecinos estables ,con casa comoda nueva con tres dormitorios ,pileta ,vestuarios ,perforacion a 90 mts. ",,,0,PE,0,,
12589,2/25/2011 0:00:00,60,Campo,Buenos Aires,Ayacucho,Ayacucho,Sobre Calle,,12445 // ,,,,0,0,0,0,0,0,0,,,,0,0,0,0,0,0,0,0,0,0,0,0,0,0,0,Disponemos de campos dentro de la Pcia de Buenos Aires. Consulte cantidad de hectarias y precio.,,,0,PE,0,,
12590,2/25/2011 0:00:00,132,Lote,Buenos Aires,La Plata,La Plata,Sobre Calle,,12446 // 69ESQ.121,,,,1,1,1,0,1,0,0,,,280,0,0,0,0,0,0,0,0,0,0,0,0,0,1,0,Lote en esquina de 10x28 con demolicion,,,0,US,0,,
12591,2/25/2011 0:00:00,132,Lote,Buenos Aires,La Plata,La Plata,Sobre Calle,,12447 // 67-3y4,,,,1,1,1,0,0,0,0,,,300,0,0,0,0,0,0,0,0,0,0,0,0,0,0,0,,,,0,US,0,,
12592,2/25/2011 0:00:00,152,Departamento,Buenos Aires,La Plata,La Plata,Sobre Calle,estacion ferroviaria,12448 // dg 80 ( 2 y 3),,,"Sobre dg 80,a 2 cuadras de la estacion ferroviaria y 4 de plaza San Martin. Exelente lugar.",1,1,1,0,1,1,1,,42,42,1,0,2,50,1,0,0,0,0,0,0,0,0,0,0,"Dg 80 e( 2 y 3),  en edificio antiguo de estilo,  4to piso en contrafrente  por ascensor, hall de distribucion ,cocina separada con lavadero cubierto incorporado y nicho para heladera, comedor , dormitorio amplio ,baño completo , exelente luminosidad y asoleamiento.Alquilado en $ 1.300.- hasta mayo del 2010.-ideal inversor.",,,0,US,63000,,
12593,2/25/2011 0:00:00,152,Departamento,Buenos Aires,La Plata,La Plata,Sobre Calle,Zona Sur,12449 // 75 ( 6 y 7),,,"Exelente lugar ,a metros de avenida 7, todas las lineas de colectivos cercanias al hospital San Martin, y facultad de medicina, acceso super rapido.",1,1,1,0,1,1,1,,45,45,1,0,2,15,1,0,0,0,0,0,0,0,0,0,0,"75 e/( 6 y 7), primer piso por escaleras a la calle,  amplio living comedor, cocina equipada separada, dormitorio con placard, baño completo, 45 mts cub, 12 años de antiguedad, sin expensas , solo dos unidades , abajo de  supermercado. ideal inversor alquilado hasta 6/2012 en $ 1.100.-apto banco.",,,0,US,45000,,
12594,2/28/2011 0:00:00,159,Departamento,Buenos Aires,La Plata,La Plata,Sobre Calle,,12450 // 528 e / 131 y 132 ,,,"mitad de cuadra  nuevos ,entrada por cochera ",1,1,1,0,1,1,1,15,42,,2,1,5,6,1,0,0,0,0,1,1,1,0,1,0,"entrada por la cochera ,al jardin con  patio ,entrada al living comedor cocina separada con muebles bajo y sobre mesada ,moderna ,baño con bañera ,un dormitorio con aire acondicionado ,y otro dormitorio con placard .IMPECABLE ",,,0,US,60000,,
12595,3/1/2011 0:00:00,77,Casa,Buenos Aires,Vicente Lopez,Vicente Lopez,Sobre Calle,,12451 // LAS HERAS,1400,,Excelente Chalet a metros de Av.Maipu,1,1,1,0,1,0,1,,180,,3,2,5,20,3,8,0,0,0,0,0,1,0,1,0,"Excelente Chalet desarrollado en dos plantas, sobre calle Las Heras al 1400, entre 25 de Mayo y Av.Maipú, excelente zona de Vte. López. El inmueble consta de:Planta Baja---HALL DE ENTRADA (3x2.20) piso de laja, guardarropa, doble circulación, ESTAR/LIVING (4.30x3.10) al frente, piso de laja san luis, ventana arco medio punto, en desnivel, TOILETTE (1.30x1) piso cerámico, revestimientos hasta el techo,  COMEDOR (5.70x2.80) contiguo al living, piso de laja, salida al patio, doble circulación,  COCINA (3.50x2.90 cocina 4 hornallas, mesada mármol granítico, alacena y bajo mesadas en formica, purificador, COMEDOR DIARIO (1.80x2) con salida al patio, PATIO (8x4) con parrilla y bacha lavaplatos, acceso al lavadero.Planta Alta---DORM PPAL (3.60x3.30) al frente, piso parquet, ventana arco medio punto, con placard, ventilación exterior, en SUITTE (3.30x1.60) compartimentado, piso cerámico, doble bacha, mesada de mármol, DORM I (2.20x3) al contrafrente, piso de parquet,con placard, ventilación exterior, BAÑO (2.45x1.20) piso de cerámica, vanitory con doble juego de bacha, ventilación exterior, DORM II (2.95x3.80) piso parquet, con placard, con balconeo tipo loft, ventilación exterior, LAVADERO (2.50x1.40) ventilación exterior, acceso por el patio.",,,0,US,230000,,
12596,3/1/2011 0:00:00,64,Casa,Buenos Aires,La Plata,Manuel B. Gonnet,Sobre Calle,,12452 // 30 y 504 bis,,,"nueva, sobre lote de 10x38",1,1,1,0,0,0,0,,85,,2,0,0,6,1,8,0,1,0,1,1,1,0,0,0,"Lote 10x38. chalet de 80m2. Muy buen distribucion, luminosa.Faltan terminaciones.-Living-comedor con barra. Cocina separada.Baño amplio.Lavadero2 dormitorios.GaragePequeño jardin al frente. Parque atraz",,,0,US,75000,,
12600,5/19/2011 0:00:00,159,Departamento,Buenos Aires,La Plata,La Plata,Sobre Calle,,12613 // 36 e 24 y 25 n 1485,,,edificio a estrenar casi  en la esquina de 25,1,1,1,0,1,1,0,,72,72,2,1,1,1,2,5,0,1,0,0,1,0,0,1,1,"a estrenar contrafrente re luminoso con living comedor pisos de madera ,amplio ,dos dormitorios con placard y aire acondicionado ,balcon corrido ,  cochera ,moderno",,,0,US,105000,,
12601,3/3/2011 0:00:00,159,Departamento,Buenos Aires,La Plata,La Plata,Sobre Calle,, 12457// 36 n 1485 e/24 y 25,,,edificio a estrenar,1,1,1,0,1,1,0,,45,45,1,1,3,1,1,0,0,1,0,0,1,0,0,0,1,"amplio depto con un dormitorio con placard ,cocina equipada con muebles bajo mesada ,baño completo ",,,0,,,PE,1600
12603,3/3/2011 0:00:00,159,Departamento,Buenos Aires,La Plata,La Plata,Sobre Calle,,12459 // 1 entre 79 y 80,,,"ph interno con lote de 10 x 30 ,entrada por pasillo hay casa adelante ",1,1,1,0,1,1,1,,80,300,2,1,6,20,2,0,0,0,0,0,1,0,0,1,0,"casa interna en PH ,jardin de  invierno ,cocina comedor ,dos dormitorios amplios , living comedor  y baño ,patio lavadero cubierto ,basño de servicio y parque  con parrilla muy bueno ",,,0,US,75000,,
12609,5/31/2011 0:00:00,137,Departamento,Buenos Aires,La Plata,La Plata,Sobre Calle,zona plaza Paso,12470 // 45 e/ 14 y 15,,,(alquilado)ideal inversor,1,1,1,0,1,1,1,,,,1,0,2,15,1,5,0,0,0,0,1,0,0,1,1,"DPTO AL CONTRAFRENTE: GRAN BALCON CON MUY LINDA VISTA, POSEE COCINA COMEDOR INTEGRADA ALACENAS Y BAJO MESADAS COMPLETOS. BAÑO COMPLETO VANITORY BAÑERA. DORMITORIO CON PLACARD COMPLETO. MUY BIEN CONSERVADO.",,,0,US,58000,,
12610,3/4/2011 0:00:00,130,Departamento,Buenos Aires,La Plata,La Plata,Sobre Calle,,12471 // 37 entre 29 y 30,,,EXCELENTE PLANTA BAJA CON GARAGE ¡¡¡¡ APTO BANCO,1,1,1,0,1,1,1,,40,,1,1,0,15,1,0,0,1,0,0,1,1,0,1,0,"EXCELENTE UNIDAD AL FRENTE EN PLANTA BAJA, LIVING COMEDOR, COCINA SEPARADA, 1 DORMITORIO AMPLIO CON PLACARD, BAÑO COMPLETO, PATIO GARAGE Y LAVADERO CUBIERTO. IMPECABLE. ACEPTA PERMUTA MAYOR. APTO BANCO",,,0,US,54000,,
12612,3/28/2011 0:00:00,152,Lote,Buenos Aires,La Plata,Manuel B. Gonnet,Sobre Calle,Villa Castel,12473 // 4 esquina 497,,,"Por calle 497 desde 13,todo por asfalto hasta calle 4 esquina 497, buen entorno, oportunidad.",1,1,1,0,0,1,0,,,400,0,0,0,0,0,0,0,0,0,0,0,0,0,0,0,"Lote esquina este , de 20x20 , zona con servicios, prospero entorno oportunidad.se escritura por Juicio de Usucapio.",,,0,PE,80000,,
12613,3/9/2011 0:00:00,60,Local,Buenos Aires,La Plata,La Plata,Sobre Calle,, 12476// 8 e/ 63 y 64,,,,1,1,0,0,1,0,0,,36,36,0,0,0,0,1,0,0,0,0,0,0,0,0,0,0,"Excelente local en muy buen estado de aprox 6 x 6, gran vidriera, ambiente y toilette, ideal destino comercial.",,,0,,,PE,1600
12614,3/10/2011 0:00:00,130,Lote,Buenos Aires,La Plata,City Bell,Sobre Calle,,12477 // 17 entre Pellegrini y Guemes,,,"17 x 50, EN LA MEJOR ZONA DE CITY BELL ¡¡¡",1,1,1,0,1,1,1,,,,0,0,0,0,0,0,0,0,0,0,0,0,0,0,0,"EXCELENTE LOTE DE 17 MTS DE FRENTE X 50 MTS DE FONDO, A CUADRAS DE CENTRO COMERCIAL DE CALLE CANTILO",,,0,US,0,,
12615,3/10/2011 0:00:00,160,Casa,Buenos Aires,La Plata,La Plata,Sobre Calle,, 12478// 24/59,,,,0,1,1,0,1,0,0,,260,260,0,2,6,40,3,9,0,0,0,0,0,1,0,1,1,"importante propiedad, apto vivienda / instituciones, 4 dor, 3 baños, consultorio con sala de espera y baño, garage para 2 vehiculos, dependencias",,,0,,,PE,3800
12616,3/12/2011 0:00:00,133,Casa,Buenos Aires,La Plata,La Plata,Sobre Calle,,12479 // 43 e 2 y 3,,,,1,1,1,0,1,1,1,317,165,152,3,1,5,0,2,9,0,0,1,0,0,0,0,1,1,"Casa de gran categoría, Planta Alta por escalera de marmol con baranda de madera ,Gran recibidor con importante bitraux, living comedor, 3 dormitorios con placar, cocina, comedor diario, baño completo, toilette, gran terraza transitable, balcones, pisos de roble de eslabonia, carpintería de madera de gran calidad, fue reciclada con criterio conservador en el que se conservaron materiales originales.Acepta Crédito Bancario. Apta para vivienda, Instituciones, consultorios o destinos diversos. ",,,0,US,0,,
12617,4/1/2011 0:00:00,133,Departamento,Buenos Aires,La Plata,La Plata,Sobre Calle,,12480 // 15 e/ 73 y 74,,,,1,1,1,0,1,1,1,14,37,51,1,1,2,20,1,0,0,0,0,0,0,1,0,1,0,"Departamento en Planta Baja al Frente, Living Comedor,1 dormitorio, cocina separada, baño, patio grande, muy luninoso, sin expensas. Apto para Crédito Bancario.",,,0,US,52000,,
12618,3/14/2011 0:00:00,56,Departamento,Buenos Aires,La Plata,La Plata,Sobre Calle,, // 48 y 8,,,La Plata -Centro-,1,1,1,0,1,1,1,,86,,2,0,3,40,1,5,0,1,0,0,0,0,0,1,1,"liv com, cocina comedor , baño, 2 dormitorios con placares, lavadero, COCHERA cubierta.-",,,0,,,,
12619,3/14/2011 0:00:00,56,Departamento,Buenos Aires,La Plata,La Plata,Sobre Calle,Centro,12481 // 48 y 8,,12,La Plata -Centro-,1,1,1,0,1,1,1,0,86,86,2,0,3,40,1,5,0,1,0,0,0,0,0,1,1,"liv com, cocina comedor , baño, 2 dormitorios con placares, lavadero, COCHERA cubierta.-",,,0,US,0,,
12620,3/14/2011 0:00:00,133,Departamento,Buenos Aires,La Plata,La Plata,Sobre Calle,Facultades - Terminal,12482 // ,,,,1,1,1,0,1,1,1,,,,1,1,2,25,1,0,0,0,0,0,0,0,0,1,0,"Departamento al frente con Living Comedor, 1 dormitorio, cocina con muebles bajo y sobre medada, baño, balcón, muy luminoso, ubicado en Zona Facultades, Terminal de ömnibus, Plaza Italia, muy bueno. Apto para crédito Bancario.",,,0,US,52000,,
12621,3/14/2011 0:00:00,152,Departamento,Buenos Aires,La Plata,La Plata,Sobre Calle,zona facultades,12484 // 4 esquina 68,,2do ,"Depto a la caale en 2do `piso por escaleras a la calle , bajas expensas, ideal estudiante por cercania de facultades, bellas Artes, medicina, Psicologia, demas.",1,0,1,0,1,1,0,,45,45,2,3,2,30,1,0,0,0,0,0,0,0,0,0,0,"Depto en buen estado, apto credito Hipotecario, ubicado en un exelente barrio, equisdistante del centro y faculades, 2do piso x escaleras al frente, cocina separada con espacio para armar lavadero, living comedor separado,con ventanas a la calle, baño con bañera, dos dormitorios con placares y pisos de parquet,estado general bueno, bajas expensas, buen mantenimiento del edificio.",,,0,US,60000,,
12624,3/18/2011 0:00:00,160,Casa,Buenos Aires,La Plata,City Bell,Sobre Calle,,12487 // 24/458,,,,0,0,1,0,0,1,0,500,130,,3,2,5,30,1,9,0,0,0,1,0,0,0,0,0,"Casa en buena zona, a 2 cuadras del Camino Gral Belgrano",,,0,US,110000,,
12625,3/14/2011 0:00:00,132,Local,Buenos Aires,La Plata,La Plata,Sobre Calle,Centro,12488 // 55-10Y11,,,Al lado de la Escuela Italiana,1,1,1,0,1,0,0,,600,600,0,0,0,0,0,0,0,1,0,0,0,0,0,1,0,LOCAL Y GALPON EN UN LOTE DE 15X40,,,0,US,400000,,
12631,3/18/2011 0:00:00,137,Monoambiente,Buenos Aires,La Plata,La Plata,Sobre Calle,, 12493// 13 Y 61,,,,1,1,1,0,1,1,1,,,,0,0,0,6,1,0,0,0,0,0,1,0,0,1,1,"COCINA INTEGRADA AL FRENTE CON BALON, POSEE BAÑO COMPLETO EXCELETNE ESTADO",,,0,,,PE,1200
12634,3/18/2011 0:00:00,132,Casa,Buenos Aires,Berisso,Berisso,Sobre Calle,,12497 // 78-125 y 125bis,,,,1,1,0,1,0,0,0,247,133,380,3,2,6,6,1,0,0,0,0,0,0,0,0,0,0,"2Plantas,P.baja local de 66.70m2 con baño,P.Alta 3dormitorios,baño con antebaño a terminar todo nuevo, y premoldeada para demoler,gran espacio verde (acepta permutas)",,,0,US,77000,,
12636,3/18/2011 0:00:00,137,Departamento,Buenos Aires,La Plata,La Plata,Sobre Calle,CENTRO,12499 // 9 E/ 44 Y 45,,,,1,1,1,0,1,1,1,,,,2,0,3,1,2,5,0,1,0,0,1,0,0,1,1,"EN OBRA. AL FRENTE, BALCON. COCINA SEPARADA CON COMEDOR DIARIO, LIVING COMEDOR, LAVADERO CUBIERTO, 75 MTS2, 2 DORMITORIOS CON PLACAR COMPLETO, CLIMATIZACION POR CONDUCTO. PISOS EN MADERA Y PORCELANATOO, CARPINTERIA EXTERIOR E INTERIOR DE PRIMERA CATEGORIA. TOILETTE, BAÑO PRINCIPAL CON HIDRO. ENTREGA JUNIO /11OPCION COCHERA",,,0,US,115000,,
12637,3/18/2011 0:00:00,137,Departamento,Buenos Aires,La Plata,La Plata,Sobre Calle,CENTRO,12500 // 59 E/ 13 Y 14,,,,1,1,1,0,1,1,1,,,,2,0,3,1,2,5,0,1,0,0,1,0,0,1,1,"EN OBRA, COCINA COMEDOR DIARIO, LAVADERO INTERNO, LIVNG COMEDOR BALCON AL FRENTE, TOILETTE, Y BAÑO PRINCIPALCON HIDRO, 2 DOMRIOTIROS CON PLACARES COMPLETOS, CLIMATIZACION POR CONDUCTO, PISOS EN MADERA Y PORCELANATOO, CARTINTERIA EXTERIOR E INTERIOR DE PRIMERA. GRAN CALIDAD. ENTREGA JUNIO /11",,,0,US,110000,,
12638,3/18/2011 0:00:00,137,Departamento,Buenos Aires,La Plata,La Plata,Sobre Calle,,12501 // 8 E/ 67 Y 68,,,,1,1,1,0,1,1,1,,,,2,0,4,1,2,5,0,0,0,0,1,0,0,1,0,"ESTRENAR EN PLANTA BAJA CON PATIO, 75MTS2 CUBIERTOS, MAS 38 MTS2 DESCUBIERTOS. COCINA COMEDOR DIARIA, LIVING COMEDOR, TOILETTE. BAÑO COMPLETO OCN HIDRO. MUY LUMINOSO. OPCIONAL COCHERA",,,0,US,100000,,
12639,3/18/2011 0:00:00,137,Departamento,Buenos Aires,La Plata,La Plata,Sobre Calle,,12502 // 9 E/ 71 Y 72,,,,1,1,1,0,1,1,1,,,,2,0,3,1,1,5,0,0,0,0,1,0,0,1,1,"EN OBRA, ENTREGA JUNIO/11. BALCON AL FRENTE, LIVING COMEDOR, COCINA SEPARADA COMPLETA CON LAVADERO INCORPORADO, BAÑO COMPLETO, 2 DORMITORIOS CON PLACAR, PISOS EN MADERA Y PORCELANATOO, CARPINTEIA INTERNA Y EXTERNA DE PRIMERA. 62 MTS2, OPCION COCHERA",,,0,US,83000,,
12640,3/30/2011 0:00:00,137,Departamento,Buenos Aires,La Plata,La Plata,Sobre Calle,,12503 // 8 E/ 67 Y 68,,,,1,1,1,0,1,1,1,,,,3,0,4,1,2,0,0,1,0,0,1,0,0,1,1,"A ESTRENAR 75 MTS2 CUBIERTOS MAS 38 MTS2 DE PATIO. 3 DORMITORIOS CON PLACARES COMPLETOS, COCINA SEPARADA LAVADERO INCORPORADO, LIIVING COMEDOR. TOILETTE, BAÑO PRINCIPAL CON HIDROMASAJE. PISOS EN MADERA EN DORMITORIOS. PLACARES COMPLETOS CON BARRAL Y ESTANTES DE 2 HOJAS. MUY LINDO. OPCIONAL COCHERA",,,0,US,100000,,
12641,3/19/2011 0:00:00,152,Departamento,Buenos Aires,La Plata,La Plata,Sobre Calle,centrico,12504 // 56 esquina 5,,,"Ubicacion estrategico,semicentrico,a 200 metros de plaza ,moreno, y 30 metros del diagonal 79. ",1,1,1,0,1,1,1,,68,68,2,0,3,30,1,0,0,0,0,0,0,0,0,0,0,"exelente depto , de dos dormitorios con placares, , amplisimo living comedor, de 7x3.5, cocina separadada con lavadero incorporado, la misma mide 1.2x 6 metros de largo,  y baño completo, tiene una antiguedad de 30 años, construccion muy solida, ,exelente vista , y buena ventilacion cruzada y soleamiento.",,,0,US,95000,,
12643,3/21/2011 0:00:00,64,Lote,Buenos Aires,La Plata,City Bell,Sobre Calle,,12507 // 30-473b y 474,,,"baldio, excelente entorno",0,1,1,0,0,0,1,,,1000,0,0,0,0,0,0,0,0,0,0,0,0,0,0,0,,,,0,US,70000,,
12644,5/11/2011 0:00:00,130,Casa,Buenos Aires,La Plata,La Plata,Sobre Calle,,12508 // 71 entre 7 y 8,,,EXCELENTE CASA ¡¡¡¡,1,1,1,0,1,1,1,,165,376,3,0,0,0,2,0,0,1,0,1,1,1,1,1,0,"EXCELENTE CASA SOBRE LOTE DE 9,91 X 38, COCHERA PARA 2 AUTOS, FONDO CON PILETA, QUINCHO SEMI CUBIERTO CON PARRILLA, COCINA COMEDOR, AMPLIO LIVING COMEDOR CON HOGAR, 2 AMPLIOS DORMITORIOS CON PLACARD, BAÑO Y ANTE BAÑO, ESCRITORIO INDEPENDIENTE; EN PLANTA ALTA 3ER DORMITORIO EN SUITTE CON HYDRO. CALEFACCIONADA POR RADIADORES, ABERTURAS DE MADERA. DE CATEGORIA. PERMUTA POR CASA MAS CHICA. ",,,0,US,0,,
12646,3/22/2011 0:00:00,160,Local,Buenos Aires,La Plata,La Plata,Sobre Calle,, 12510// 60/148,,,,0,1,0,0,1,0,0,,24,24,0,0,1,0,0,0,0,0,0,0,0,0,0,1,0,"Local, vidriera con rejas, cortina ciega, piso de granito, baño.- ",,,0,,,PE,1000
12648,3/23/2011 0:00:00,160,Departamento,Buenos Aires,La Plata,La Plata,Sobre Calle,,12512 // 3/39,,,,0,1,1,0,1,0,1,6,67,73,2,2,4,15,2,5,0,0,0,0,0,0,0,1,1,"Dpto al frente de gran categoria, dormitorios con aire acondicionado y placard, baño en suite, balcon, excelente estado.-",,,0,US,119000,,
12649,3/23/2011 0:00:00,77,Departamento,Buenos Aires,Vicente Lopez,Olivos,Sobre Calle,Residencial,12513 // Ricardo Gutierrez,1300,B,"Exc. zona residencial, sobre calle Ricardo Gutierrez entre Av Maipu y Cordoba. A estrenar.",1,1,1,0,1,1,0,3,33,,1,0,1,1,1,5,0,1,0,0,0,0,0,1,0,"Dptos de 1 y 2 ambientes a estrenar desde U$S 62.200Edificio con 2 subsuelos y 6 pisos con 33 departamentos de 1 y 2 ambientes. 5º y 6º piso en duplex.Amenities: Health Club con acceso inpendienteCafeteriaGymSalon de JuegosPiscina con solariumQuincho con parrillasSumCocheras cubiertas en subsuelosSeguridad 24 hsExcelente calidad Constructiva: calefacción individual por piso radiante con caldera Aristón, pisos en porcelanato, amplios ventanales, carpintería de aluminio aluar linea modena anodizado natural, curtain walls vidrio solexia green, mesadas en travertino, griferia fv de diseño.Opcion cocheras U$S 15.000Forma de pago: 40% boleto. 10% a la posesion y 50% en cuotas.Financiación: Opciones hasta 50 cuotas fijas sin interes.Ideal inversoresConsultar disponibilidadEntrega 2012.Garantia certificada 2 años.Syrah Global Developer---------------------------------- ",,,0,US,62200,,
12650,3/23/2011 0:00:00,77,Departamento,Buenos Aires,Vicente Lopez,Olivos,Sobre Calle,Residencial,12514 // Ricardo Gutierrez,1300,E,Exc. zona residencial entre calles Cordoba y Av Maipu. A estrenar.,1,1,1,0,1,1,0,3,33,,1,1,1,1,1,0,0,1,0,0,0,1,1,0,0,"Dptos de 1 y 2 ambientes a estrenar desde U$S 62.200Edificio con 2 subsuelos y 6 pisos con 33 departamentos de 1 y 2 ambientes. 5º y 6º piso en duplex.Amenities: Health Club con acceso inpendienteCafeteriaGymSalon de JuegosPiscina con solariumQuincho con parrillasSumCocheras cubiertas en subsuelosSeguridad 24 hsExcelente calidad Constructiva: calefacción individual por piso radiante con caldera Aristón, pisos en porcelanato, amplios ventanales, carpintería de aluminio aluar linea modena anodizado natural, curtain walls vidrio solexia green, mesadas en travertino, griferia fv de diseño.Opcion cocheras U$S 15.000Forma de pago: 40% boleto. 10% a la posesion y 50% en cuotas.Financiación: Opciones hasta 50 cuotas fijas sin interes.Ideal inversoresConsultar disponibilidadEntrega 2012.Garantia certificada 2 años.Syrah Global Developer---------------------------------- ",,,0,US,66175,,
12651,3/23/2011 0:00:00,77,Departamento,Buenos Aires,Vicente Lopez,Olivos,Sobre Calle,Residencial,12515 // Ricardo Gutierrez,1300,6,Exc. zona residencial entre calles Cordoba y Av Maipu. A estrenar.,1,1,1,0,1,1,0,3,71,,1,2,2,1,2,3,0,1,0,0,0,0,1,0,1,"Dpto 2amb en 6º piso de 71.3m2, sobre calle Ricardo Gutierrez entre Córdoba y Tucumán. Consta de: PB: Cocina(1.70X3.55),  estar comedor (3.70x8.55); balcón (1.10x3.15); baño (1.50x2.00)PA: Dormitorio (3.85x4.58), toilette (1.10x1.60).Dptos de 1 y 2 ambientes a estrenar desde U$S 62.200Edificio con 2 subsuelos y 6 pisos con 33 departamentos de 1 y 2 ambientes. 5º y 6º piso en duplex.Amenities:  *Health Club con acceso independiente*Cafetería*Gym*Salón de Juegos*Piscina con solarium*Quincho con parrillas*Sum*Cocheras cubiertas en subsuelos*Seguridad 24 hs Excelente calidad Constructiva: calefacción individual por piso radiante con caldera Aristón, pisos en porcelanato, amplios ventanales, carpintería de aluminio aluar línea modena anodizado natural, curtain walls vidrio solexia green, mesadas en travertino, grifería fv de diseño.Opción cocheras U$S 15.000Forma de pago: 40% boleto. 10% a la posesión y 50% en cuotas.Financiación: Opciones hasta 50 cuotas fijas sin interés.Ideal inversoresConsultar disponibilidadEntrega 2012.Garantía certificada 2 años.Syrah Global Developer----------------------------------",,,0,US,141000,,
12655,3/28/2011 0:00:00,160,Casa,Buenos Aires,La Plata,La Plata,Sobre Calle,EL RODEO,12519 // 308/48,,,,0,1,0,0,0,0,0,1000,60,60,1,1,3,10,1,9,0,0,0,1,0,0,1,0,0,"Casa quinta en barrio  EL RODEO, lote de 20 x 50, pileta de 4 x 12 con hidro, galeria, parrilla, arboleda.-  ",,,0,US,72000,,
12658,3/30/2011 0:00:00,152,Departamento,Buenos Aires,La Plata,La Plata,Sobre Calle,La Loma,12522 // 29 ( 37 y 38),,,"Muy lindo barrio, zona recidencial,a dos cuadras del parque castelli.",1,1,1,0,1,1,1,20,55,75,2,0,3,20,1,0,0,0,0,0,0,0,0,0,0,"Departamnento en planta baja por pasillo, sobre edificio de dos plantas, pasillo semicubierto, de unos 12 metros, el depto esta en impecable estado,bien mantenido, consta de un amplio living comedor,cocina comedor integrada por arcada, dos dormitotios con placares,baño completo, patio amplio envaldosado.sin expensas, apto banco,desocupado.",,,0,US,60000,,
12659,3/30/2011 0:00:00,137,Departamento,Buenos Aires,La Plata,La Plata,Sobre Calle,,12523 // 22 e 64 y 65,1575,,a una cuadra de diagonal 74,1,1,1,0,1,1,0,,,,2,0,3,10,1,5,0,1,0,0,1,0,0,1,0,"cocina amoblada completa separada por barra desayunadora, balcon al contrafrente, living comedor, 2 dormitorios con placar, baño completo. opcional cochera",,,0,US,65000,,
12660,3/30/2011 0:00:00,130,Lote,Buenos Aires,La Plata,Melchor Romero,Sobre Calle,,12524 // 170 entre 517 y 518,,,MUY BUENA ZONA,1,1,1,0,0,0,0,,,,0,0,0,0,0,0,0,0,0,0,0,0,0,0,0,"SON 2 LOTES DE 16 X 26 CADA UNO, Y EL VALOR ES DE u$S 20.000 CADA UNO",,,0,US,20000,,
12662,3/31/2011 0:00:00,160,Departamento,Buenos Aires,La Plata,La Plata,Sobre Calle,, 12526// 1/54,,,,0,1,1,0,1,0,0,,,65,2,0,3,30,1,5,0,0,0,0,0,0,0,1,1,"Dpto en edificio denominado Palacio del Bosque, 2 dor, fte, muy luminoso, recien pintado, buen estado ",,,0,,,PE,1800
